{
  "schema_version": "1.0", "artifact_type": "director_brief", "episode_id": "ep001", "sequence_id": "seq-002", "shot_id": "shot-009",
  "source": {"beat_refs": ["beat-002"], "dramatic_purpose": "재가 따뜻한 부스러기로 돌아오며 테오가 다시 일곱 살의 식탁에 있음을 조용히 확인한다."},
  "canvas": {"width_px": 1536, "height_px": 2048, "safe_margin_norm": 0.06},
  "scroll": {"display_width_ratio": 0.78, "whitespace_before_px": 120, "whitespace_after_px": 540, "transition_in": "fade", "transition_out": "gutter"},
  "camera": {"shot_size": "extreme_close_up", "angle": "top_down", "lens_feel": "normal", "position": "테오 손끝 바로 위", "movement": "pull_out", "focus": "재가 빵 부스러기로 바뀌어 손가락 옆에 남는 순간"},
  "subjects": [{"character_id": "theo-waldhart", "bbox_norm": {"x": 0.20, "y": 0.48, "width": 0.50, "height": 0.35}, "depth": "foreground", "pose": "느슨하게 펴진 작은 손", "expression": "얼굴은 보이지 않음", "gaze": "프레임 밖", "action": "손끝으로 따뜻한 부스러기 하나를 만진다", "identity_invariants": ["일곱 살의 작은 손", "푸른 회색 소매", "얼굴과 전신 없음"], "references": [{"path": "visual-bible/characters/theo-waldhart-canonical-v4.png", "role": "character_identity", "asset_id": "theo-waldhart-canonical-v4"}]}],
  "background": {"location_id": "arken-fall-memory", "description": "종이빛 공백을 통과한 회색 재가 현재 식탁의 따뜻한 빵 부스러기로 되돌아오는 전환", "source_crop_norm": {"x": 0.05, "y": 0.76, "width": 0.90, "height": 0.20}, "perspective": "안정된 탑뷰", "depth_layers": ["테오의 손", "부스러기와 마지막 재", "어두운 참나무 식탁"], "lighting": "따뜻한 식탁 빛이 낮게 돌아온다", "references": [{"path": "visual-bible/backgrounds/arken-fall-memory-montage-v1.png", "role": "background_space", "asset_id": "arken-fall-memory-montage-v1"}]},
  "art_direction": {"line": "손끝과 부스러기를 깨끗하게", "color": "차가운 재색에서 따뜻한 베이지로 복귀", "rendering": "간결한 2D 전환", "mood": "아직 말하지 않은 결심", "composition": "아래로 긴 여백을 둬 식탁의 대화가 다시 들어오게 한다", "must_avoid": ["마법 효과", "성인 손", "얼굴", "읽을 수 있는 글자"]},
  "text": {"mode": "none", "items": [], "reserved_regions": []},
  "continuity": {"previous_shot_id": "shot-008", "screen_direction": "neutral", "state_in": ["성인 손과 장부가 재가 된다"], "state_out": ["테오는 식탁으로 돌아왔다", "빵 부스러기가 손가락 옆에 남는다"]},
  "output": {"path": "episodes/ep001/art/shot-009.png", "format": "png", "quality": "high"}
}
