{
  "schema_version": "1.0", "artifact_type": "director_brief", "episode_id": "ep001", "sequence_id": "seq-005", "shot_id": "shot-017",
  "source": {"beat_refs": ["beat-005"], "dramatic_purpose": "테오가 창가에서 물·길·나루를 한 장의 문제로 보기 시작하는 첫 관찰의 순간을 만든다."},
  "canvas": {"width_px": 1536, "height_px": 2048, "safe_margin_norm": 0.05},
  "scroll": {"display_width_ratio": 0.86, "whitespace_before_px": 300, "whitespace_after_px": 80, "transition_in": "gutter", "transition_out": "continuous"},
  "camera": {"shot_size": "medium_full", "angle": "over_shoulder", "lens_feel": "normal", "position": "테오 뒤에서 서쪽 창을 향해", "movement": "push_in", "focus": "창틀에 손을 올린 작은 테오와 멀리 내려다보이는 강"},
  "subjects": [{"character_id": "theo-waldhart", "bbox_norm": {"x": 0.28, "y": 0.35, "width": 0.30, "height": 0.52}, "depth": "midground", "pose": "낮은 돌창턱 앞에 선 뒷모습", "expression": "얼굴은 옆선만, 생각에 잠김", "gaze": "창밖의 강과 나루", "action": "한 손을 창턱에 올리고 아래를 훑는다", "identity_invariants": ["일곱 살의 작은 체격", "밤색 머리", "푸른 회색 튜닉의 작은 은색 세 잎 문장"], "references": [{"path": "visual-bible/characters/theo-waldhart-canonical-v4.png", "role": "character_identity", "asset_id": "theo-waldhart-canonical-v4"}]}],
  "background": {"location_id": "rowend-march", "description": "월트 요새의 깊은 서쪽 창 너머로 보이는 마른 마든 강, 갈대 습지, 낡은 목제 수문과 멀리 흐린 그레이포드 나루", "source_crop_norm": {"x": 0.02, "y": 0.04, "width": 0.52, "height": 0.72}, "perspective": "창틀이 전경을 만들고 강은 아래 왼쪽에서 멀리 오른쪽으로 이어진다", "depth_layers": ["돌창턱과 테오 손", "창틀·마른 강·수문", "갈대 습지와 흐린 나루"], "lighting": "초해빙의 흐린 낮빛, 빛기둥 없음", "references": [{"path": "visual-bible/backgrounds/walt-fort-dining-hall-v1.png", "role": "background_space", "asset_id": "walt-fort-dining-hall-v1"}]},
  "art_direction": {"line": "창틀과 테오 실루엣은 또렷하게, 먼 강은 간결하게", "color": "청회색 물·갈대색·차가운 석재", "rendering": "웹툰풍 2D 거리감", "mood": "어린아이의 눈으로 시작된 행정적 관찰", "composition": "창밖 상단의 하늘과 먼 풍경에 독백 여백을 둔다", "must_avoid": ["극적인 햇살", "환상적 거대 성", "현대 시설", "읽을 수 있는 글자"]},
  "text": {"mode": "deterministic_lettering", "items": [{"kind": "thought", "speaker": "theo-waldhart", "content": "로웬드는 물이 많고, 길은 짧고, 가진 것보다 빚이 먼저 움직인다.", "anchor_norm": {"x": 0.55, "y": 0.08, "width": 0.34, "height": 0.16}}], "reserved_regions": [{"x": 0.52, "y": 0.04, "width": 0.40, "height": 0.23}]},
  "continuity": {"previous_shot_id": "shot-016", "screen_direction": "left_to_right", "state_in": ["테오는 빚이라는 말을 붙잡고 있다"], "state_out": ["테오가 창밖의 수문·제방·나루를 한 흐름으로 본다"]},
  "output": {"path": "episodes/ep001/art/shot-017.png", "format": "png", "quality": "high"}
}
