{
  "schema_version": "1.0", "artifact_type": "director_brief", "episode_id": "ep001", "sequence_id": "seq-002", "shot_id": "shot-005",
  "source": {"beat_refs": ["beat-002"], "dramatic_purpose": "흰 빵 부스러기가 차가운 재로 바뀌는 긴 낙하로 전생 회상을 시작한다."},
  "canvas": {"width_px": 1536, "height_px": 2048, "safe_margin_norm": 0.06},
  "scroll": {"display_width_ratio": 0.82, "whitespace_before_px": 360, "whitespace_after_px": 140, "transition_in": "fade", "transition_out": "continuous"},
  "camera": {"shot_size": "extreme_close_up", "angle": "top_down", "lens_feel": "normal", "position": "테오 손끝과 공중의 부스러기 사이", "movement": "tilt", "focus": "흰 부스러기가 고운 회색 재로 분해되는 경계"},
  "subjects": [{"character_id": "theo-waldhart", "bbox_norm": {"x": 0.09, "y": 0.67, "width": 0.42, "height": 0.25}, "depth": "foreground", "pose": "하단에서 사라지는 작은 손", "expression": "얼굴은 보이지 않음", "gaze": "프레임 밖", "action": "부스러기를 놓아 재가 위로 흩어진다", "identity_invariants": ["작은 아이 손", "푸른 회색 소매 끝", "얼굴 없음"], "references": [{"path": "visual-bible/characters/theo-waldhart-canonical-v4.png", "role": "character_identity", "asset_id": "theo-waldhart-canonical-v4"}]}],
  "background": {"location_id": "arken-fall-memory", "description": "아이보리 회색 공백 위에서 빵 부스러기가 재가 되는 기억 전환", "source_crop_norm": {"x": 0.03, "y": 0.19, "width": 0.94, "height": 0.34}, "perspective": "수직 낙하를 강조하는 추상적 탑뷰", "depth_layers": ["작은 손", "흩어지는 부스러기와 재", "종이빛 기억 공백"], "lighting": "차갑고 평평한 회색빛, 햇살 기둥 없음", "references": [{"path": "visual-bible/backgrounds/arken-fall-memory-montage-v1.png", "role": "background_space", "asset_id": "arken-fall-memory-montage-v1"}]},
  "art_direction": {"line": "재 입자만 섬세하게, 나머지는 절제", "color": "흰색에서 차가운 숯회색으로", "rendering": "맑은 2D 분해 효과", "mood": "조용한 추락", "composition": "상단의 긴 빈 공간으로 아래 장면을 기다리게 한다", "must_avoid": ["불꽃 폭발", "마법 문양", "성인 얼굴", "읽을 수 있는 글자"]},
  "text": {"mode": "deterministic_lettering", "items": [{"kind": "thought", "speaker": "theo-waldhart", "content": "전생의 나는 아르켄 왕국의 재상이었다.", "anchor_norm": {"x": 0.49, "y": 0.14, "width": 0.34, "height": 0.12}}], "reserved_regions": [{"x": 0.45, "y": 0.08, "width": 0.42, "height": 0.22}]},
  "continuity": {"previous_shot_id": "shot-004", "screen_direction": "neutral", "state_in": ["테오의 눈이 부스러기를 보고 있다"], "state_out": ["부스러기가 모두 재가 된다", "현재의 식탁이 지워진다"]},
  "output": {"path": "episodes/ep001/art/shot-005.png", "format": "png", "quality": "high"}
}
