{
  "schema_version": "1.0", "artifact_type": "director_brief", "episode_id": "ep001", "sequence_id": "seq-001", "shot_id": "shot-004",
  "source": {"beat_refs": ["beat-001", "beat-002"], "dramatic_purpose": "테오의 시선이 멈추며 식탁의 평온에서 내면의 기억으로 들어가는 문턱을 만든다."},
  "canvas": {"width_px": 1536, "height_px": 2048, "safe_margin_norm": 0.05},
  "scroll": {"display_width_ratio": 0.82, "whitespace_before_px": 40, "whitespace_after_px": 360, "transition_in": "overlap", "transition_out": "fade"},
  "camera": {"shot_size": "close_up", "angle": "eye_level", "lens_feel": "portrait", "position": "테오 앞의 낮은 식탁 높이", "movement": "push_in", "focus": "부스러기를 내려다본 뒤 멀어지는 테오의 회색 눈"},
  "subjects": [{"character_id": "theo-waldhart", "bbox_norm": {"x": 0.21, "y": 0.20, "width": 0.54, "height": 0.64}, "depth": "foreground", "pose": "턱을 조금 내린 정면 반신", "expression": "순간적으로 굳은 죄책감", "gaze": "프레임 아래의 부스러기", "action": "손을 식탁 위에 멈춘다", "identity_invariants": ["일곱 살 얼굴 비율", "회색 눈", "밤색 헝클어진 머리", "푸른 회색 튜닉"], "references": [{"path": "visual-bible/characters/theo-waldhart-canonical-v4.png", "role": "character_identity", "asset_id": "theo-waldhart-canonical-v4"}]}],
  "background": {"location_id": "walt-fort-dining-hall", "description": "뒤의 식당은 옅게 흐려지고, 식탁 위 부스러기만 하단에 남는다", "source_crop_norm": {"x": 0.24, "y": 0.20, "width": 0.52, "height": 0.65}, "perspective": "테오 눈높이의 얕은 심도", "depth_layers": ["테오의 얼굴", "손과 식탁", "흐린 난로와 벽"], "lighting": "평범한 저녁빛이 천천히 차가운 회색으로 바뀜", "references": [{"path": "visual-bible/backgrounds/walt-fort-dining-hall-v1.png", "role": "background_space", "asset_id": "walt-fort-dining-hall-v1"}]},
  "art_direction": {"line": "눈과 손가락 주변만 섬세하게", "color": "따뜻한 현재색에서 회색 기억색으로 내려감", "rendering": "깨끗한 2D 채색과 얕은 흐림", "mood": "말없이 열리는 기억", "composition": "상단 오른쪽은 재 입자가 들어올 빈 공간으로 둔다", "must_avoid": ["눈물 과장", "마법 효과", "극적인 역광", "읽을 수 있는 글자"]},
  "text": {"mode": "none", "items": [], "reserved_regions": []},
  "continuity": {"previous_shot_id": "shot-003", "screen_direction": "neutral", "state_in": ["부스러기가 손끝에 모여 있다"], "state_out": ["식당이 흐려진다", "테오가 기억 속으로 가라앉는다"]},
  "output": {"path": "episodes/ep001/art/shot-004.png", "format": "png", "quality": "high"}
}
