{
  "schema_version": "1.0", "artifact_type": "director_brief", "episode_id": "ep001", "sequence_id": "seq-002", "shot_id": "shot-006",
  "source": {"beat_refs": ["beat-002"], "dramatic_purpose": "사람 없는 빈 곡물창으로 숫자 뒤에 사라진 생존을 압축해 보인다."},
  "canvas": {"width_px": 1536, "height_px": 2048, "safe_margin_norm": 0.06},
  "scroll": {"display_width_ratio": 1.0, "whitespace_before_px": 40, "whitespace_after_px": 100, "transition_in": "continuous", "transition_out": "continuous"},
  "camera": {"shot_size": "wide", "angle": "eye_level", "lens_feel": "wide", "position": "작은 석조 곡물창 입구에서 빈 선반을 향해", "movement": "locked", "focus": "비어 있는 선반과 납작하게 꺼진 곡물 자루"},
  "subjects": [{"character_id": "theo-waldhart", "bbox_norm": {"x": 0.04, "y": 0.77, "width": 0.14, "height": 0.16}, "depth": "foreground", "pose": "프레임 가장자리의 사라지는 어린 손 실루엣", "expression": "얼굴은 보이지 않음", "gaze": "프레임 밖", "action": "재 한 점이 손끝에서 창고 바닥으로 떨어진다", "identity_invariants": ["작은 손만 보임", "성인 모습이나 얼굴 없음", "현재의 테오가 기억을 보는 구도"], "references": [{"path": "visual-bible/characters/theo-waldhart-canonical-v4.png", "role": "character_identity", "asset_id": "theo-waldhart-canonical-v4"}]}],
  "background": {"location_id": "arken-fall-memory", "description": "비어 있는 선반과 납작한 자루만 남은 작은 석조 곡물창의 단편", "source_crop_norm": {"x": 0.03, "y": 0.43, "width": 0.94, "height": 0.22}, "perspective": "좁은 창고의 선반이 좌우에서 중앙의 빈 바닥으로 향함", "depth_layers": ["재와 손끝", "빈 바닥과 곡물 자루", "석벽과 비어 있는 선반"], "lighting": "먼지 낀 회색 확산광", "references": [{"path": "visual-bible/backgrounds/arken-fall-memory-montage-v1.png", "role": "background_space", "asset_id": "arken-fall-memory-montage-v1"}]},
  "art_direction": {"line": "거친 사실화가 아닌 깨끗한 웹툰 선", "color": "바랜 종이색·숯회색·작은 갈색", "rendering": "절제된 2D 공간감", "mood": "비어 있어 더 무거운 기억", "composition": "인물보다 빈 선반과 바닥이 화면을 지배하게 한다", "must_avoid": ["사람", "시체", "전쟁 장면", "수도 전경", "읽을 수 있는 글자"]},
  "text": {"mode": "none", "items": [], "reserved_regions": []},
  "continuity": {"previous_shot_id": "shot-005", "screen_direction": "neutral", "state_in": ["재가 아래로 흩어진다"], "state_out": ["재가 장부 장면으로 이어진다", "곡물창은 사람이 없는 상태로 남는다"]},
  "output": {"path": "episodes/ep001/art/shot-006.png", "format": "png", "quality": "high"}
}
