{
  "schema_version": "1.0", "artifact_type": "director_brief", "episode_id": "ep001", "sequence_id": "seq-005", "shot_id": "shot-019",
  "source": {"beat_refs": ["beat-005"], "dramatic_purpose": "카일의 밝은 내일 제안과 테오의 즉답이 형제 역할의 출발점을 코믹하게 보여준다."},
  "canvas": {"width_px": 1536, "height_px": 2048, "safe_margin_norm": 0.05},
  "scroll": {"display_width_ratio": 0.92, "whitespace_before_px": 20, "whitespace_after_px": 340, "transition_in": "continuous", "transition_out": "gutter"},
  "camera": {"shot_size": "medium", "angle": "eye_level", "lens_feel": "portrait", "position": "창가 안쪽에서 테오와 카일을 서로 마주 보게", "movement": "locked", "focus": "몸을 숙여 제안하는 카일과 망설임 없이 답하는 테오"},
  "subjects": [
    {"character_id": "theo-waldhart", "bbox_norm": {"x": 0.22, "y": 0.42, "width": 0.27, "height": 0.42}, "depth": "midground", "pose": "창턱에서 돌아서 팔짱을 가볍게 낀다", "expression": "지극히 진지한 즉답", "gaze": "카일", "action": "먼저 창고를 보자고 말한다", "identity_invariants": ["작은 체격", "회색 눈", "푸른 회색 튜닉"], "references": [{"path": "visual-bible/characters/theo-waldhart-canonical-v4.png", "role": "character_identity", "asset_id": "theo-waldhart-canonical-v4"}]},
    {"character_id": "kyle-waldhart", "bbox_norm": {"x": 0.57, "y": 0.26, "width": 0.29, "height": 0.55}, "depth": "midground", "pose": "창틀에 한 손을 대고 몸을 앞으로 기울인다", "expression": "밝고 기대에 찬 미소", "gaze": "테오", "action": "내일 훈련이 끝나면 나루까지 함께 가자고 제안한다", "identity_invariants": ["열네 살의 긴 팔다리", "붉은 갈색 머리", "문장 없는 푸른 저킨"], "references": [{"path": "visual-bible/characters/kyle-waldhart-canonical-v2.png", "role": "character_identity", "asset_id": "kyle-waldhart-canonical-v2"}]}
  ],
  "background": {"location_id": "walt-fort-dining-hall", "description": "서쪽 창과 창턱, 멀리 강의 흐린 줄기가 보이는 식당 창가", "source_crop_norm": {"x": 0.04, "y": 0.12, "width": 0.52, "height": 0.68}, "perspective": "창틀의 수직선 안에서 두 형제가 좌우로 마주 보는 구도", "depth_layers": ["창턱", "테오와 카일", "창밖 강과 갈대"], "lighting": "차분한 해빙기 낮빛이 실내에 낮게 든다", "references": [{"path": "visual-bible/backgrounds/walt-fort-dining-hall-v1.png", "role": "background_space", "asset_id": "walt-fort-dining-hall-v1"}]},
  "art_direction": {"line": "두 형제의 시선과 손짓을 선명하게", "color": "청회색 의상 둘과 흐린 강의 같은 계열", "rendering": "가볍고 단정한 2D 연기", "mood": "서로 다른 방식으로 영지를 바라보는 형제", "composition": "상단 좌우에 짧은 말풍선 두 개가 들어갈 여백", "must_avoid": ["카일의 브로치", "테오의 성인 체격", "읽을 수 있는 글자"]},
  "text": {"mode": "deterministic_lettering", "items": [{"kind": "dialogue", "speaker": "kyle-waldhart", "content": "내일 훈련 끝나면 나루까지 같이 갈래?", "anchor_norm": {"x": 0.60, "y": 0.06, "width": 0.30, "height": 0.15}}, {"kind": "dialogue", "speaker": "theo-waldhart", "content": "그 전에 창고부터요.", "anchor_norm": {"x": 0.08, "y": 0.08, "width": 0.28, "height": 0.12}}], "reserved_regions": [{"x": 0.57, "y": 0.03, "width": 0.36, "height": 0.22}, {"x": 0.05, "y": 0.04, "width": 0.34, "height": 0.20}]},
  "continuity": {"previous_shot_id": "shot-018", "screen_direction": "right_to_left", "state_in": ["영지의 취약한 풍경이 보였다"], "state_out": ["카일과 테오는 창가에 함께 선다", "멀리서 첫 노크가 시작된다"]},
  "output": {"path": "episodes/ep001/art/shot-019.png", "format": "png", "quality": "high"}
}
