{
  "schema_version": "1.0", "artifact_type": "director_brief", "episode_id": "ep001", "sequence_id": "seq-006", "shot_id": "shot-021",
  "source": {"beat_refs": ["beat-006"], "dramatic_purpose": "문이 열리고 이름 없는 전령의 급한 목소리만으로 강의 이상 징후를 전달한다."},
  "canvas": {"width_px": 1536, "height_px": 2048, "safe_margin_norm": 0.05},
  "scroll": {"display_width_ratio": 1.0, "whitespace_before_px": 20, "whitespace_after_px": 80, "transition_in": "cut", "transition_out": "cut"},
  "camera": {"shot_size": "medium_full", "angle": "over_shoulder", "lens_feel": "normal", "position": "문턱 안쪽에서 브람의 등 너머로 복도를 향해", "movement": "push_in", "focus": "문을 연 브람과 복도 끝에서 고개 숙인 전령의 비식별 실루엣"},
  "subjects": [
    {"character_id": "bram-waldhart", "bbox_norm": {"x": 0.22, "y": 0.20, "width": 0.32, "height": 0.66}, "depth": "foreground", "pose": "문 앞에 선 등과 반측면", "expression": "턱선만 굳어 보임", "gaze": "문밖 아래", "action": "문을 열고 급보를 듣는다", "identity_invariants": ["망토 없는 숲색 더블릿", "넓은 중년 어깨", "짧은 수염 윤곽"], "references": [{"path": "visual-bible/characters/bram-waldhart-canonical-v1.png", "role": "character_identity", "asset_id": "bram-waldhart-canonical-v1"}]},
    {"character_id": "kyle-waldhart", "bbox_norm": {"x": 0.66, "y": 0.42, "width": 0.17, "height": 0.36}, "depth": "midground", "pose": "문 쪽으로 몸을 일으킨 반신", "expression": "즉시 경계", "gaze": "문밖", "action": "의자에서 일어나며 허리 쪽으로 손을 옮긴다", "identity_invariants": ["열네 살 소년 체형", "붉은 갈색 머리", "문장 없는 푸른 저킨"], "references": [{"path": "visual-bible/characters/kyle-waldhart-canonical-v2.png", "role": "character_identity", "asset_id": "kyle-waldhart-canonical-v2"}]}
  ],
  "background": {"location_id": "walt-fort-dining-hall", "description": "열린 동쪽 문과 어두운 복도, 문밖 전령은 구체적 얼굴·복장 없이 급히 고개 숙인 실루엣으로만 보인다", "source_crop_norm": {"x": 0.58, "y": 0.06, "width": 0.36, "height": 0.84}, "perspective": "브람의 어깨를 전경으로, 열린 문을 중앙으로 둔다", "depth_layers": ["브람의 어깨", "문틀과 카일", "어두운 복도와 비식별 전령 실루엣"], "lighting": "식당의 따뜻한 빛과 복도의 차가운 빛이 경계에서 만남", "references": [{"path": "visual-bible/backgrounds/walt-fort-dining-hall-v1.png", "role": "background_space", "asset_id": "walt-fort-dining-hall-v1"}]},
  "art_direction": {"line": "브람의 굳은 어깨와 카일의 반응을 선명하게", "color": "실내 따뜻함과 복도 청회색의 낮은 대비", "rendering": "인물을 추가 확정하지 않는 2D 연출", "mood": "뉴스가 가족 식탁에 들어오는 순간", "composition": "문밖 아래쪽을 대사 오버레이로 비우며 전령의 얼굴은 어떤 방식으로도 읽히지 않게 한다", "must_avoid": ["전령의 캐릭터 디자인 확정", "영웅적 포즈", "읽을 수 있는 글자"]},
  "text": {"mode": "deterministic_lettering", "items": [{"kind": "dialogue", "speaker": null, "content": "영주님! 그레이포드에서 급보입니다! 강이 너무 빨리 불고 있습니다!", "anchor_norm": {"x": 0.55, "y": 0.06, "width": 0.35, "height": 0.19}}], "reserved_regions": [{"x": 0.51, "y": 0.03, "width": 0.41, "height": 0.26}]},
  "continuity": {"previous_shot_id": "shot-020", "screen_direction": "right_to_left", "state_in": ["문이 닫혀 있고 첫 노크가 끝났다"], "state_out": ["문이 열렸다", "강의 수위가 비정상적으로 오르고 있다는 정보가 전달된다"]},
  "output": {"path": "episodes/ep001/art/shot-021.png", "format": "png", "quality": "high"}
}
